ID,Nombre,Clasificación,Proceso,Periodicidad,Sentido,Fórmula,Responsable,Fuente
53,Eficacia en planes de acción implementados,✅,✅,✅,❌,✅,✅,Ficha Técnica
54,CALIDAD DE AGUA POTABLE SEDE CAMPUS,✅,✅,✅,❌,✅,✅,Ficha Técnica
56,"	
CONSUMO DE PAPEL SEDE CAMPUS",✅,✅,✅,❌,✅,✅,Ficha Técnica
58,EBITDA,✅,✅,✅,✅,✅,✅,Ficha Técnica
61,CONSUMO ENERGÍA ELÉCTRICA SEDE CAMPUS,✅,✅,✅,❌,✅,✅,Ficha Técnica
62,GESTIÓN DEL AIRE SEDE CAMPUS,✅,✅,✅,❌,✅,✅,Ficha Técnica
63,MANTENIMIENTO DISEÑO PAISAJÍSTICO SEDE CAMPUS,✅,✅,✅,❌,✅,✅,Ficha Técnica
64,EDUCACIÓN AMBIENTAL,✅,✅,✅,❌,✅,✅,Ficha Técnica
65,EFICACIA EN CAPACITACIÓN AMBIENTAL,✅,✅,✅,❌,✅,✅,Ficha Técnica
66,CUMPLIMIENTO SGA SEDE CAMPUS,✅,✅,✅,❌,✅,✅,Ficha Técnica
67,CONSUMO DE AGUA SEDE CAMPUS,✅,✅,✅,❌,✅,✅,Ficha Técnica
68,Evaluación de desempeño a proveedores críticos,✅,✅,✅,✅,✅,✅,Ficha Técnica
69,Oportunidad de respuesta solicitudes de compra no ,✅,✅,✅,✅,✅,✅,Ficha Técnica
70,Ejecución presupuestal CAPEX Infraestructura,✅,✅,✅,❌,❌,✅,Ficha Técnica
71,Ejecución presupuestal OPEX infraestructura,✅,✅,✅,❌,❌,✅,Ficha Técnica
73,Tiempo respuesta selección y contratación de colab,✅,✅,✅,✅,✅,✅,Ficha Técnica
74,Efectividad en las contrataciones,✅,✅,✅,✅,✅,✅,Ficha Técnica
77,Disponibilidad de servicios tecnológicos,✅,✅,✅,✅,✅,✅,Ficha Técnica
78,Cumplimiento Programa De Auditoría,✅,✅,✅,✅,✅,✅,Ficha Técnica
79,Cierre Eficaz De Oportunidades De Mejora De Audito,✅,✅,✅,✅,✅,✅,Ficha Técnica
84,Funcionamiento del Copasst,✅,✅,✅,✅,✅,✅,Ficha Técnica
85,Plan de Emergencias,✅,✅,✅,✅,✅,✅,Ficha Técnica
86,Reporte e Investigación,✅,✅,✅,✅,✅,✅,Ficha Técnica
87,Autoevaluación,✅,✅,✅,✅,✅,✅,Ficha Técnica
88,Seguimiento del plan de trabajo,✅,✅,✅,✅,✅,✅,Ficha Técnica
89,Ejecución plan de capacitación,✅,✅,✅,✅,✅,✅,Ficha Técnica
90,Ejecución de Simulacros,✅,✅,✅,✅,✅,✅,Ficha Técnica
91,Participación en capacitaciones SST,✅,✅,✅,✅,✅,✅,Ficha Técnica
92,Evaluación condiciones de salud (Examen Médico),✅,✅,✅,✅,✅,✅,Ficha Técnica
94,Cobertura de colaboradores con Elementos de Protec,✅,✅,✅,✅,✅,✅,Ficha Técnica
95,Inspecciones de seguridad,✅,✅,✅,✅,✅,✅,Ficha Técnica
96,Inducción Institucional,✅,✅,✅,✅,✅,✅,Ficha Técnica
100,Cumplimiento de requisitos legales SST,✅,✅,✅,✅,✅,✅,Ficha Técnica
104,Tasa de accidentalidad,✅,✅,✅,✅,✅,✅,Ficha Técnica
106,Mortalidad de los accidentes laborales,✅,✅,✅,✅,✅,✅,Ficha Técnica
108,Nivel de Satisfacción Servicios Prestados,✅,✅,✅,✅,✅,✅,Ficha Técnica
109,Nivel de satisfacción de los servicios prestados,✅,✅,✅,✅,✅,❌,Ficha Técnica
110,Nivel de Satisfacción Servicios Prestados,✅,✅,✅,✅,✅,✅,Ficha Técnica
111,NIVEL DE SATISFACCIÓN SERVICIOS PRESTADOS,✅,✅,✅,✅,✅,✅,Ficha Técnica
112,Nivel de Satisfacción Servicios Prestados,✅,✅,✅,✅,✅,✅,Ficha Técnica
113,Nivel de Satisfacción Servicios Prestados,✅,✅,✅,✅,✅,✅,Ficha Técnica
114,Nivel de satisfacción de los servicios prestados -,✅,✅,✅,✅,✅,✅,Ficha Técnica
115,Nivel de Satisfacción Servicios Prestados,✅,✅,✅,✅,✅,✅,Ficha Técnica
116,Nivel de Satisfacción Servicios Prestados - Percep,✅,✅,✅,✅,✅,✅,Ficha Técnica
117,Nivel de Satisfacción Servicios Prestados,✅,✅,✅,✅,✅,✅,Ficha Técnica
118,Nivel de Satisfacción del sistema de gestión de ca,✅,✅,✅,✅,✅,✅,Ficha Técnica
121,Ejecución presupuestal de la nómina acumulada,✅,✅,✅,✅,✅,✅,Ficha Técnica
122,Eficacia en la solicitud documental- por periodo,✅,✅,✅,✅,✅,✅,Ficha Técnica
124,Indice de Frecuencia de accidentalidad,✅,✅,✅,✅,✅,✅,Ficha Técnica
125,Indice de severidad,✅,✅,✅,✅,✅,✅,Ficha Técnica
126,Indice de Prevalencia EL Enfermedad laboral,✅,✅,✅,✅,✅,✅,Ficha Técnica
127,Indice de Incidencia EL Enfermedad laboral,✅,✅,✅,✅,✅,✅,Ficha Técnica
128,Ausentísmo por causa médica,✅,✅,✅,✅,✅,✅,Ficha Técnica
131,Movilidad  Saliente ,✅,✅,✅,✅,✅,✅,Ficha Técnica
132,Movilidad  Entrante ,✅,✅,✅,✅,✅,✅,Ficha Técnica
133,Nivel de Satisfacción Servicios Prestados,✅,✅,✅,✅,✅,✅,Ficha Técnica
134,COMPENSACIÓN HUELLA DE CARBONO SEDE CAMPUS,✅,✅,✅,❌,✅,✅,Ficha Técnica
135,Nivel de cumplimiento de la gestión de internacion,✅,✅,✅,✅,✅,✅,Ficha Técnica
136,Ejecución de actividades culturales,✅,✅,✅,✅,✅,✅,Ficha Técnica
137,Ejecución de Talleres de formación,✅,✅,✅,✅,✅,✅,Ficha Técnica
139,Ejecución presupuestal del gasto,✅,✅,✅,✅,✅,✅,Ficha Técnica
140,Ejecución presupuestal del CAPEX,✅,✅,✅,✅,❌,✅,Ficha Técnica
141,Cumplimiento Semana 0 - Pregrado,✅,✅,✅,✅,✅,✅,Ficha Técnica
142,Cumplimiento semana 0 - Postgrado,✅,✅,✅,✅,✅,✅,Ficha Técnica
143,Proyectos de investigación e innovación- Metrica,✅,✅,✅,✅,✅,✅,Ficha Técnica
144,Productos de investigación,✅,✅,✅,✅,✅,✅,Ficha Técnica
145,"Semilleros de investigación, innovación y creación",✅,✅,✅,✅,✅,✅,Ficha Técnica
146,Profesores vinculados a investigación,✅,✅,✅,✅,✅,✅,Ficha Técnica
147,Grupos de investigación reconocidos y categorizado,✅,✅,✅,✅,✅,✅,Ficha Técnica
148,Estudiantes vinculados a investigación,✅,✅,✅,✅,✅,✅,Ficha Técnica
150,Nivel de Satisfacción Servicios Prestados,✅,✅,✅,✅,✅,✅,Ficha Técnica
151,Nivel de Satisfacción Servicios Prestados,✅,✅,✅,✅,✅,✅,Ficha Técnica
152,APLICACIÓN EVALUACIÓN DESEMPEÑO PROVEEDORES,✅,✅,✅,❌,✅,✅,Ficha Técnica
153,Ampliación del alcance de la certificación ISO 900,✅,✅,✅,✅,✅,✅,Ficha Técnica
154,Seguimiento Plan de desarrollo Institucional,✅,✅,✅,✅,✅,✅,Ficha Técnica
157,Indexación de bases de datos o sires,✅,✅,✅,✅,✅,✅,Ficha Técnica
158,Proyectos editoriales de investigación e innovació,✅,✅,✅,✅,✅,✅,Ficha Técnica
159,Nivel de Satisfacción Servicios Prestados,✅,✅,✅,✅,✅,✅,Ficha Técnica
160,VALORIZACIÓN DE RESIDUOS CONVENCIONALES SEDE CAMPU,✅,✅,✅,❌,✅,✅,Ficha Técnica
161,VALORIZACIÓN DE RESIDUOS PELIGROSOS SEDE CAMPUS,✅,✅,✅,❌,✅,✅,Ficha Técnica
162,GASES EFECTO INVERNADERO SEDE CAMPUS,✅,✅,✅,❌,✅,✅,Ficha Técnica
163,Participación estudiantes eventos académicos inter,✅,✅,✅,✅,✅,✅,Ficha Técnica
164,Participación docentes eventos académicos internac,✅,✅,✅,✅,✅,✅,Ficha Técnica
167,Satisfacción actividades plan de bienestar,✅,✅,✅,✅,✅,✅,Ficha Técnica
168,CUMPLIMIENTO DE GESTIÓN DE PROYECTOS,✅,✅,✅,✅,✅,✅,Ficha Técnica
171,ANS documentos operativos,✅,✅,✅,✅,✅,✅,Ficha Técnica
172,Cumplimiento plan operativo del SGC,✅,✅,✅,✅,✅,✅,Ficha Técnica
174,Cumplimiento plan de formación SGC,✅,✅,✅,✅,✅,✅,Ficha Técnica
175,CUMPLIMIENTO DE CRONOGRAMA GESTIÓN DE RESIDUOS,✅,✅,✅,❌,✅,✅,Ficha Técnica
176,Cumplimiento planes de mejora,✅,✅,✅,✅,✅,✅,Ficha Técnica
177,CUMPLIMIENTO DE REQUISITOS DE LA NORMATIVIDAD AMBI,✅,✅,✅,❌,✅,✅,Ficha Técnica
178,CALIDAD DE AGUA POTABLE SEDE CITY CAMPUS,✅,✅,✅,❌,✅,✅,Ficha Técnica
179,CONSUMO DE PAPEL SEDE CITY CAMPUS,✅,✅,✅,❌,✅,✅,Ficha Técnica
180,CONSUMO ENERGÍA ELÉCTRICA SEDE CITY CAMPUS,✅,✅,✅,❌,✅,✅,Ficha Técnica
181,GESTIÓN DEL AIRE SEDE CITY CAMPUS,✅,✅,✅,❌,✅,✅,Ficha Técnica
182,MANTENIMIENTO DISEÑO PAISAJÍSTICO SEDE CITY CAMPUS,✅,✅,✅,❌,✅,✅,Ficha Técnica
185,CUMPLIMIENTO SGA SEDE CITY CAMPUS,✅,✅,✅,❌,✅,✅,Ficha Técnica
186,CONSUMO DE AGUA SEDE CITY CAMPUS,✅,✅,✅,❌,✅,✅,Ficha Técnica
188,COMPENSACIÓN HUELLA DE CARBONO SEDE CITY CAMPUS,✅,✅,✅,❌,✅,✅,Ficha Técnica
189,VALORIZACIÓN DE RESIDUOS CONVENCIONALES SEDE CITY ,✅,✅,✅,❌,✅,✅,Ficha Técnica
190,VALORIZACIÓN DE RESIDUOS PELIGROSOS SEDE CITY CAMP,✅,✅,✅,❌,✅,✅,Ficha Técnica
191,GASES EFECTO INVERNADERO SEDE CITY CAMPUS,✅,✅,✅,❌,✅,✅,Ficha Técnica
192,ACTIVIDADES MANEJO INTEGRAL DE RESIDUOS SEDE CITY ,✅,✅,✅,❌,✅,✅,Ficha Técnica
193,Porcentaje de Cumplimiento del Acuerdo de Nivel de,✅,✅,✅,✅,✅,✅,Ficha Técnica
194,Índice de satisfacción del estudiante (SSI),✅,✅,✅,✅,✅,✅,Ficha Técnica
195,NPS- Net Promotor Score,✅,✅,✅,✅,✅,✅,Ficha Técnica
196,(% de solicitudes procesos Pareto),✅,✅,✅,✅,✅,✅,Ficha Técnica
197,Cumplimiento cronograma Mantenimiento de Equipos,✅,✅,✅,✅,✅,✅,Ficha Técnica
198,Proyectos Tecnológicos,✅,✅,✅,✅,✅,✅,Ficha Técnica
199,Nivel de cumplimiento de eficacia las capacitacion,✅,✅,✅,✅,✅,✅,Ficha Técnica
200,Nivel de efectividad de las capacitaciones,✅,✅,✅,✅,✅,✅,Ficha Técnica
202,Great Place to Work,✅,✅,✅,✅,✅,✅,Ficha Técnica
203,Cumplimiento de Ingresos,✅,✅,✅,✅,✅,✅,Ficha Técnica
204,Caja,✅,✅,✅,✅,✅,✅,Ficha Técnica
205,Utilidad Neta,✅,✅,✅,✅,✅,✅,Ficha Técnica
206,Inversión en CAPEX de la utilidad anterior,✅,✅,✅,✅,✅,✅,Ficha Técnica
207,Nivel de Cumplimiento Opex,✅,✅,✅,✅,✅,✅,Ficha Técnica
208,Consumo de Agua m3 Mensual,✅,✅,✅,✅,✅,✅,Ficha Técnica
209,Consumo de Agua m3 Campus,✅,✅,✅,✅,✅,✅,Ficha Técnica
210,Aporte de los Procesos a los Objetivos de Desarrol,✅,✅,✅,✅,✅,✅,Ficha Técnica
213,Cumplimiento del Plan Anual del Sistema de Gestión,✅,✅,✅,✅,✅,✅,Ficha Técnica
214,Generación de Residuos Sólidos Mensual,✅,✅,✅,✅,✅,✅,Ficha Técnica
215,Disminución de la Generación de Residuos per Cápit,✅,✅,✅,✅,✅,✅,Ficha Técnica
216,Disposición Ambientalmente Adecuada de Residuos Pe,✅,✅,✅,✅,✅,✅,Ficha Técnica
217,Aprovechamiento de Residuos,✅,✅,✅,✅,✅,✅,Ficha Técnica
218,Consumo de Energía Eléctrica kWh Mensual,✅,✅,✅,✅,✅,✅,Ficha Técnica
219,Disminución del Consumo de Energía Eléctrica per C,✅,✅,✅,✅,✅,✅,Ficha Técnica
220,Disminución del Consumo de Agua per Cápita,✅,✅,✅,✅,✅,✅,Ficha Técnica
221,Riesgo de la Calidad del Agua Potable,✅,✅,✅,✅,✅,✅,Ficha Técnica
222,Calidad de las Aguas Residuales Domesticas,✅,✅,✅,✅,✅,✅,Ficha Técnica
223,Registro de Publicidad Exterior Visual,✅,✅,✅,✅,✅,✅,Ficha Técnica
224,Cumplimiento Nivel de Emisión de Ruido,✅,✅,✅,✅,✅,✅,Ficha Técnica
225,Acciones para el Cuidado y Mantenimiento de las Es,✅,✅,✅,✅,✅,✅,Ficha Técnica
226,Generación de Gases de Efecto Invernadero,✅,✅,✅,✅,✅,✅,Ficha Técnica
227,Generación de  Gases de Efecto Invernadero per Cáp,✅,✅,✅,✅,✅,✅,Ficha Técnica
228,Compensación de Gases de Efecto Invernadero,✅,✅,✅,✅,✅,✅,Ficha Técnica
230,Ejecución de Eventos de Formación en Materia Ambie,✅,✅,✅,✅,✅,✅,Ficha Técnica
231,Asistencia Eventos de Formación en Materia Ambient,✅,✅,✅,✅,✅,✅,Ficha Técnica
232,Ejecución de las Comunicaciones en Materia Ambient,✅,✅,✅,✅,✅,✅,Ficha Técnica
233,Impacto de las Comunicaciones Correo Electrónico,✅,✅,✅,✅,✅,✅,Ficha Técnica
234,Impacto de las Comunicaciones en Materia Ambiental,✅,✅,✅,✅,✅,✅,Ficha Técnica
235,Cumplimiento de Requisitos Legales Ambientales Apl,✅,✅,✅,✅,✅,✅,Ficha Técnica
236,Actos Administrativos o Decisiones Judiciales Ambi,✅,✅,✅,✅,✅,✅,Ficha Técnica
237,Cumplimiento Proyecto nuevo Polisigs,✅,✅,✅,✅,✅,✅,Ficha Técnica
238,Cumplimiento de la Protección del Medio Ambiente,✅,✅,✅,✅,✅,✅,Ficha Técnica
239,Portafolio De Proyectos - Metrica,✅,✅,✅,✅,✅,✅,Ficha Técnica
240,Cumplimiento De Gestión De Proyectos Cerrados,✅,✅,✅,✅,✅,✅,Ficha Técnica
241,Cumplimiento De Gestión De Proyectos Fase Inicio,✅,✅,✅,✅,✅,✅,Ficha Técnica
242,Cumplimiento A Cronograma De Proyectos,✅,✅,✅,✅,✅,✅,Ficha Técnica
243,Cumplimiento De Gestión De Proyectos Control De Ca,✅,✅,✅,✅,✅,✅,Ficha Técnica
244,GreenMetric - Nacional,✅,✅,✅,✅,✅,✅,Ficha Técnica
245,Tasa de Permanencia Intersemestral,✅,✅,✅,✅,✅,✅,Ficha Técnica
246,Satisfacción del proceso de grados presencial,✅,✅,✅,✅,✅,✅,Ficha Técnica
247,Solicitud de certificados,✅,✅,✅,✅,✅,✅,Ficha Técnica
248,Programas Con Reforzamiento Curricular,✅,✅,✅,✅,✅,✅,Ficha Técnica
249,Programas Con Matriz De Resultado De Aprendizaje,✅,✅,✅,✅,✅,✅,Ficha Técnica
250,Cumplimiento de cronograma de reportes de planes a,✅,✅,✅,✅,✅,✅,Ficha Técnica
251,Subprocesos Con CMI Estructurado.,✅,✅,✅,✅,✅,✅,Ficha Técnica
252,Tasa de Permanencia Intersemestral de Estudiantes ,✅,✅,✅,✅,✅,✅,Ficha Técnica
253,Oportunidad en la entrega de informes de auditoria,✅,✅,✅,✅,✅,✅,Ficha Técnica
254,Áreas con reportes de plan de retos,✅,✅,✅,✅,✅,✅,Ficha Técnica
255,Informe anual de variación de índice H - Metrica,✅,✅,✅,✅,✅,✅,Ficha Técnica
256,Publicaciones editadas por la editorial,✅,✅,✅,✅,✅,✅,Ficha Técnica
257,N° de publicaciones aprobadas en convocatorias,✅,✅,✅,✅,✅,✅,Ficha Técnica
258,N° de publicaciones incluidas para indexación,✅,✅,✅,✅,✅,✅,Ficha Técnica
259,Subprocesos con indicadores reportados oportunamen,✅,✅,✅,✅,✅,✅,Ficha Técnica
260,CES- Costumer Effort Score del proceso de Rematríc,✅,✅,✅,✅,✅,✅,Ficha Técnica
261,CES- Costumer Effort Score del proceso de Saber Pr,✅,✅,✅,✅,✅,✅,Ficha Técnica
262,Reducción de número de sentencias condenatorias en,✅,✅,✅,✅,✅,✅,Ficha Técnica
263,Oportunidad de respuesta de PQRS,✅,✅,✅,✅,✅,✅,Ficha Técnica
264,Eficiencia Emisión De Conceptos Jurídicos (Educaci,✅,✅,✅,✅,✅,✅,Ficha Técnica
265,Eficiencia Emisión De Conceptos Jurídicos (Jurídic,✅,✅,✅,✅,✅,✅,Ficha Técnica
266,Oportunidad en la elaboración de contratos,✅,✅,✅,✅,✅,✅,Ficha Técnica
267,Satisfacción procesos de Homologaciones,✅,✅,✅,✅,✅,✅,Ficha Técnica
268,Cantidad de usuarios,✅,✅,✅,✅,✅,✅,Ficha Técnica
269,N de personas promedio por evento,✅,✅,✅,✅,✅,✅,Ficha Técnica
270,N de horas promedio por evento,✅,✅,✅,✅,✅,✅,Ficha Técnica
271,N de horas por solicitud,✅,✅,✅,✅,✅,✅,Ficha Técnica
272,Proporción de accidentes de trabajo mortales,✅,✅,✅,✅,✅,✅,Ficha Técnica
273,Número de programas con condiciones iniciales elab,✅,✅,✅,✅,✅,✅,Ficha Técnica
274,Cumplimiento total estudiantes antiguos,✅,✅,✅,✅,✅,✅,Ficha Técnica
275,Satisfacción Institucional por grupo de interes,✅,✅,✅,✅,✅,✅,Ficha Técnica
276,Relación Estudiante-Docente Tiempo completo,✅,✅,✅,✅,✅,✅,Ficha Técnica
277,Relación estudiante docente Tiempo Completo Equiva,✅,✅,✅,✅,✅,✅,Ficha Técnica
278,Docentes contratados - Metrica,✅,✅,✅,✅,✅,✅,Ficha Técnica
279,Docentes tiempo completo,✅,✅,✅,✅,✅,✅,Ficha Técnica
280,Docentes medio tiempo,✅,✅,✅,✅,✅,✅,Ficha Técnica
281,Docentes cátedra,✅,✅,✅,✅,✅,✅,Ficha Técnica
282,Cobertura de Docentes evaluados,✅,✅,✅,✅,✅,✅,Ficha Técnica
283,Resultado evaluación docente,✅,✅,✅,✅,✅,✅,Ficha Técnica
284,N° Horas semanales docentes,✅,✅,✅,✅,✅,✅,Ficha Técnica
285,Docentes con plan de trabajo asignado,✅,✅,✅,✅,✅,✅,Ficha Técnica
286,Total docentes por nivel de estudios,✅,✅,✅,✅,✅,✅,Ficha Técnica
287,N° docentes escalafonados,✅,✅,✅,✅,✅,✅,Ficha Técnica
288,Número docentes escalafonados presentados en convo,✅,✅,✅,✅,✅,✅,Ficha Técnica
289,Cumplimiento plan de comunicaciones SGC,✅,✅,✅,✅,✅,✅,Ficha Técnica
290,Cierre eficaz de las oportunidades de mejora,✅,✅,✅,✅,✅,✅,Ficha Técnica
291,Cumplimiento del cronograma de actividades deporti,✅,✅,✅,✅,✅,✅,Ficha Técnica
292,Participación en Actividades deportivas presencial,✅,✅,✅,✅,✅,✅,Ficha Técnica
293,Cumplimiento del cronograma de actividades cultura,✅,✅,✅,✅,✅,✅,Ficha Técnica
294,Participación en actividades culturales presencial,✅,✅,✅,✅,✅,✅,Ficha Técnica
295,Cumplimiento Del Cierre Oportuno De Oportunidades ,✅,✅,✅,✅,✅,✅,Ficha Técnica
296,Cumplimiento de planes de supervisión y monitoreo ,✅,✅,✅,✅,✅,✅,Ficha Técnica
297,N° de riesgos intervenidos,✅,✅,✅,✅,✅,✅,Ficha Técnica
298,N° de riesgos materializados,✅,✅,✅,✅,✅,✅,Ficha Técnica
299,Variación del presupuesto asignado a los proyectos,✅,✅,✅,✅,✅,✅,Ficha Técnica
300,Cumplimiento de Inspecciones de control,✅,✅,✅,✅,✅,✅,Ficha Técnica
301,Cumplimiento plan de trabajo,✅,✅,✅,✅,✅,✅,Ficha Técnica
302,N de solicitudes radicadas,✅,✅,✅,✅,✅,✅,Ficha Técnica
303,Cumplimiento del cronograma de actividades de salu,✅,✅,✅,✅,✅,✅,Ficha Técnica
304,Impacto de Campañas de promoción y prevención,✅,✅,✅,✅,✅,✅,Ficha Técnica
305,Cumplimiento del plan anual de mantenimiento de eq,✅,✅,✅,✅,✅,✅,Ficha Técnica
306,Seguimiento KPI Plan de Desarrollo Institucional,✅,✅,✅,✅,✅,✅,Ficha Técnica
307,Organización de escenarios de visibilidad nacional,✅,✅,✅,✅,✅,✅,Ficha Técnica
308,Movilidad Física Entrantes Profesores,✅,✅,✅,✅,✅,✅,Ficha Técnica
309,Movilidad Física Profesores Salientes,✅,✅,✅,✅,✅,✅,Ficha Técnica
310,Movilidad Física Entrante Estudiantes,✅,✅,✅,✅,✅,✅,Ficha Técnica
311,Movilidad Física Saliente Estudiantes,✅,✅,✅,✅,✅,✅,Ficha Técnica
312,Clases espejo,✅,✅,✅,✅,✅,✅,Ficha Técnica
313,Seminarios y cursos internacionales virtuales impa,✅,✅,✅,✅,✅,✅,Ficha Técnica
314,N de asignaturas COIL - (Collaborative Online Inte,✅,✅,✅,✅,✅,✅,Ficha Técnica
315,Num de programas con convenios de doble titulación,✅,✅,✅,✅,✅,✅,Ficha Técnica
316,Asignaturas con sesiones en segundo idioma,✅,✅,✅,✅,✅,✅,Ficha Técnica
317,Plan De Internacionalización A 7 Años,✅,✅,✅,✅,✅,✅,Ficha Técnica
318,"Convenios, alianzas activas con actividades en los",✅,✅,✅,✅,✅,✅,Ficha Técnica
319,Nivel de cumplimiento de la gestión de internacion,✅,✅,✅,✅,✅,✅,Ficha Técnica
320,Participación docentes Poli en eventos académicos ,✅,✅,✅,✅,✅,✅,Ficha Técnica
321,Participación estudiantes Poli en eventos académic,✅,✅,✅,✅,✅,✅,Ficha Técnica
322,Cumplimiento Total estudiantes antiguos,✅,✅,✅,✅,✅,✅,Ficha Técnica
323,Número de renovaciones de registro calificado apro,✅,✅,✅,✅,✅,✅,Ficha Técnica
324,Número de programas nuevos radicados en el Ministe,✅,✅,✅,✅,✅,✅,Ficha Técnica
325,Número de programas nuevos con registro calificado,✅,✅,✅,✅,✅,✅,Ficha Técnica
326,Número de informes de autoevaluación con fines de ,✅,✅,✅,✅,✅,✅,Ficha Técnica
327,Número de programas con obtención de acreditación ,✅,✅,✅,✅,✅,✅,Ficha Técnica
328,Nivel de encuestas obtenidas en el encuentro insti,✅,✅,✅,✅,✅,✅,Ficha Técnica
541,Participación de graduados en actividades de emple,✅,✅,✅,✅,✅,✅,Ficha Técnica
330,Espacios de apropiación de la política de graduado,✅,✅,✅,✅,✅,✅,Ficha Técnica
331,Nivel de empleabilidad del graduado,✅,✅,✅,✅,✅,✅,Ficha Técnica
332,Índice de rotación,✅,✅,✅,✅,✅,✅,Ficha Técnica
333,Indexación de bases de datos o SIRES,✅,✅,✅,✅,❌,✅,Ficha Técnica
334,Resultado de la evaluación 360 (evaluación por com,✅,✅,✅,✅,✅,✅,Ficha Técnica
335,Cumplimiento de diagnóstico necesidades de capacit,✅,✅,✅,✅,✅,✅,Ficha Técnica
336,Materiales bibliográficos en formato físico con es,✅,✅,✅,✅,✅,✅,Ficha Técnica
337,Número de programas con renovación de acreditación,✅,✅,✅,✅,✅,✅,Ficha Técnica
338,Número de programas con condiciones iniciales apro,✅,✅,✅,✅,✅,✅,Ficha Técnica
339,Programas acreditables acreditados Sede Bogotá,✅,✅,✅,✅,✅,✅,Ficha Técnica
340,Cumplimiento cronograma revisiones locativas,✅,✅,✅,✅,✅,✅,Ficha Técnica
341,Reducción de costos en gestión de abastecimiento,✅,✅,✅,✅,✅,✅,Ficha Técnica
342,% Profesores formados en innovación pedagógica,✅,✅,✅,✅,✅,✅,Ficha Técnica
343,Cumplimiento de la eficacia de las capacitaciones ,✅,✅,✅,✅,✅,✅,Ficha Técnica
344,Cumplimiento del plan de Inducción institucional,✅,✅,✅,✅,✅,✅,Ficha Técnica
345,% de profesores impactados plan de desarrollo doce,✅,✅,✅,✅,✅,✅,Ficha Técnica
346,% de profesores impactados en actividades de Biene,✅,✅,✅,✅,✅,✅,Ficha Técnica
347,Legalizaciones y anticipos,✅,✅,✅,✅,✅,✅,Ficha Técnica
348,Cuentas por pagar,✅,✅,✅,✅,✅,✅,Ficha Técnica
349,N° de redes de investigación,✅,✅,✅,✅,✅,✅,Ficha Técnica
350,"Centros de investigación, ciencia y de apoyo a CTI",✅,✅,✅,✅,✅,✅,Ficha Técnica
351,Partidas conciliatorias de bancos,✅,✅,✅,✅,✅,✅,Ficha Técnica
352,Nivel de facturas generadas con error,✅,✅,✅,✅,✅,✅,Ficha Técnica
353,Cobertura de tableros BI en procesos,✅,✅,✅,✅,✅,✅,Ficha Técnica
354,Plan de formación en analitica,✅,✅,✅,✅,✅,✅,Ficha Técnica
355,Indice de liquidez,✅,✅,✅,✅,✅,✅,Ficha Técnica
356,Indice de Endeudamiento,✅,✅,✅,✅,✅,✅,Ficha Técnica
357,Cartera,✅,✅,✅,✅,✅,✅,Ficha Técnica
358,"Nivel de acompañamiento a estudiantes en práctica
",✅,✅,✅,✅,✅,✅,Ficha Técnica
359,Satisfacción Institucional CSAT,✅,✅,✅,✅,✅,✅,Ficha Técnica
360,NPS Employer,✅,✅,✅,✅,✅,✅,Ficha Técnica
361,Índice de Inclusión,✅,✅,✅,✅,✅,✅,Ficha Técnica
362,Aseguramiento de matricula académica presencial,✅,✅,✅,✅,✅,✅,Ficha Técnica
363,Seguimiento a la parametrización de aulas master y,✅,✅,✅,✅,✅,✅,Ficha Técnica
364,Impacto de actividades de Responsabilidad y proyec,✅,✅,✅,✅,✅,✅,Ficha Técnica
365,Seguimiento de asignación docente a NRC Pregrado-P,✅,✅,✅,✅,✅,✅,Ficha Técnica
366,Normalización de cobros pecuniarios,✅,✅,✅,✅,✅,✅,Ficha Técnica
367,Estudiantes con Becas,✅,✅,✅,✅,✅,✅,Ficha Técnica
368,Satisfacción de los estudiantes de Educación para ,✅,✅,✅,✅,✅,✅,Ficha Técnica
369,Participación de POLI- voluntariados (Estudiantes-,✅,✅,✅,✅,✅,✅,Ficha Técnica
370,Oportunidades de mejora - Huella Verde,✅,✅,✅,✅,✅,✅,Ficha Técnica
371,Recaudación de fondos,✅,✅,✅,✅,✅,✅,Ficha Técnica
372,Satisfacción de los clientes corporativos Educació,✅,✅,✅,✅,✅,✅,Ficha Técnica
373,Cumplimiento de planes anuales por líneas,✅,✅,✅,✅,✅,✅,Ficha Técnica
374,Disponibilidad de máster modalidad virtual,✅,✅,✅,✅,✅,✅,Ficha Técnica
375,Disponibilidad de catálogo de asignaturas pregrado,✅,✅,✅,✅,✅,✅,Ficha Técnica
376,Cumplimiento EBITDA,✅,✅,✅,✅,✅,✅,Ficha Técnica
377,CAPEX,✅,✅,✅,✅,✅,✅,Ficha Técnica
378,Proyectos Tecnológicos,✅,✅,✅,✅,✅,✅,Ficha Técnica
379,Total estudiantes nuevos,✅,✅,✅,✅,✅,✅,Ficha Técnica
380,Ingresos de matriculas de estudiantes nuevos,✅,✅,✅,✅,✅,✅,Ficha Técnica
381,Cumplimiento de matrículas pregrado presencial nue,✅,✅,✅,✅,✅,✅,Ficha Técnica
382,Cumplimiento de matrículas pregrado virtual nuevos,✅,✅,✅,✅,✅,✅,Ficha Técnica
383,Cumplimiento de matrículas posgrado virtual nuevos,✅,✅,✅,✅,✅,✅,Ficha Técnica
384,Cumplimiento de matrículas posgrado presencial nue,✅,✅,✅,✅,✅,✅,Ficha Técnica
385,Ingresos totales de educación para la vida,✅,✅,✅,✅,✅,✅,Ficha Técnica
386,Cumplimiento Meta comercial Educación para toda la,✅,✅,✅,✅,✅,✅,Ficha Técnica
387,Programas con reforzamiento curricular por escuela,✅,✅,✅,✅,✅,✅,Ficha Técnica
388,Programas con matriz de resultados de aprendizaje ,✅,✅,✅,❌,❌,❌,Ficha Técnica
389,Permanencia por escuela,✅,✅,✅,✅,✅,✅,Ficha Técnica
390,Cumplimiento Plan Anual por escuela,✅,✅,✅,✅,✅,✅,Ficha Técnica
391,Satisfacción del cliente con campañas integradas d,✅,✅,✅,✅,✅,✅,Ficha Técnica
392,Ahorro institucional con base en la monetización d,✅,✅,✅,✅,✅,✅,Ficha Técnica
393,Disminución de los tiempos empleados en el desarro,✅,✅,✅,✅,✅,✅,Ficha Técnica
394,Publicaciones en medios de comunicación Tier 1 y T,✅,✅,✅,✅,✅,✅,Ficha Técnica
395,Publicaciones en medios de comunicación de la regi,✅,✅,✅,✅,✅,✅,Ficha Técnica
396,Publicaciones en el Campus Virtual,✅,✅,✅,✅,✅,✅,Ficha Técnica
397,Gestión de casos del Estudio de Grabación Virtual,✅,✅,✅,✅,✅,✅,Ficha Técnica
398,Participación en actividades de desarrollo de Cult,✅,✅,✅,✅,✅,✅,Ficha Técnica
399,Sesiones de Acompañamiento a emprendedores en crea,✅,✅,✅,✅,✅,✅,Ficha Técnica
400,Puesta en marcha de proyectos de emprendimiento,✅,✅,✅,✅,✅,✅,Ficha Técnica
